{
  "$id": "https://schemas.example.invalid/shared-caddy/v1/baseline-transaction.schema.json",
  "$schema": "https://json-schema.org/draft/2020-12/schema",
  "additionalProperties": false,
  "properties": {
    "archive_id": {"pattern": "^[0-9a-f]{64}$", "type": "string"},
    "baseline_provenance_sha256": {"pattern": "^[0-9a-f]{64}$", "type": "string"},
    "compose_sha256": {"pattern": "^[0-9a-f]{64}$", "type": "string"},
    "contract_version": {"const": "shared-caddy-contract/v1"},
    "declaration_sha256": {"pattern": "^[0-9a-f]{64}$", "type": "string"},
    "deployment_id": {"pattern": "^[a-z0-9](?:[a-z0-9-]{0,61}[a-z0-9])?--[a-z0-9](?:[a-z0-9-]{0,30}[a-z0-9])?$", "type": "string"},
    "environment": {"pattern": "^[a-z0-9](?:[a-z0-9-]{0,30}[a-z0-9])?$", "type": "string"},
    "fragment_sha256": {"pattern": "^[0-9a-f]{64}$", "type": "string"},
    "git_sha": {"pattern": "^(?:[0-9a-f]{40}|[0-9a-f]{64})$", "type": "string"},
    "helper_requirement_sha256": {"pattern": "^[0-9a-f]{64}$", "type": "string"},
    "helper_sha256": {"pattern": "^[0-9a-f]{64}$", "type": "string"},
    "helper_version": {"const": "1.0.0"},
    "hosts": {"items": {"pattern": "^[a-z0-9](?:[a-z0-9-]{0,61}[a-z0-9])?(?:\\.[a-z0-9](?:[a-z0-9-]{0,61}[a-z0-9])?)*$", "type": "string"}, "minItems": 1, "type": "array", "uniqueItems": true},
    "new_generation": {"pattern": "^gen-[0-9a-f]{32}$", "type": "string"},
    "old_generation": {"pattern": "^gen-[0-9a-f]{32}$", "type": "string"},
    "phase": {"enum": ["prepared", "current-switched", "reloaded", "smoked", "verified", "committed"]},
    "project_id": {"pattern": "^[a-z0-9](?:[a-z0-9-]{0,61}[a-z0-9])?$", "type": "string"},
    "schema_version": {"const": "shared-caddy-baseline-transaction/v1"},
    "server_manifest_sha256": {"pattern": "^[0-9a-f]{64}$", "type": "string"},
    "source_repo": {"pattern": "^https://(?=[^/]{1,253}/)[a-z0-9](?:[a-z0-9-]{0,61}[a-z0-9])?(?:\\.[a-z0-9](?:[a-z0-9-]{0,61}[a-z0-9])?)*(?:/[A-Za-z0-9._~-]+)+$", "type": "string"},
    "transaction_id": {"pattern": "^tx-[0-9a-f]{32}$", "type": "string"}
  },
  "required": ["schema_version", "phase", "contract_version", "helper_version", "helper_sha256", "transaction_id", "project_id", "environment", "deployment_id", "source_repo", "archive_id", "git_sha", "declaration_sha256", "fragment_sha256", "compose_sha256", "helper_requirement_sha256", "baseline_provenance_sha256", "server_manifest_sha256", "old_generation", "new_generation", "hosts"],
  "title": "Shared Caddy v1 durable legacy baseline transaction",
  "type": "object"
}
